From	Entry	Reviewed	Entry Name	Protein names	Gene Names	Organism	Length
Q9H171	Q9H171	reviewed	ZBP1_HUMAN	Z-DNA-binding protein 1 (DNA-dependent activator of IFN-regulatory factors) (DAI) (Tumor stroma and activated macrophage protein DLM-1)	ZBP1 C20orf183 DLM1	Homo sapiens (Human)	429
P80370	P80370	reviewed	DLK1_HUMAN	Protein delta homolog 1 (DLK-1) (pG2) [Cleaved into: Fetal antigen 1 (FA1)]	DLK1 DLK	Homo sapiens (Human)	383
Q14790	Q14790	reviewed	CASP8_HUMAN	Caspase-8 (CASP-8) (EC 3.4.22.61) (Apoptotic cysteine protease) (Apoptotic protease Mch-5) (CAP4) (FADD-homologous ICE/ced-3-like protease) (FADD-like ICE) (FLICE) (ICE-like apoptotic protease 5) (MORT1-associated ced-3 homolog) (MACH) [Cleaved into: Caspase-8 subunit p18; Caspase-8 subunit p10]	CASP8 MCH5	Homo sapiens (Human)	479
P42574	P42574	reviewed	CASP3_HUMAN	Caspase-3 (CASP-3) (EC 3.4.22.56) (Apopain) (Cysteine protease CPP32) (CPP-32) (Protein Yama) (SREBP cleavage activity 1) (SCA-1) [Cleaved into: Caspase-3 subunit p17; Caspase-3 subunit p12]	CASP3 CPP32	Homo sapiens (Human)	277
Q5QP59	Q5QP59	unreviewed	Q5QP59_HUMAN	Bcl-2-like protein 1	BCL2L1	Homo sapiens (Human)	48
Q16665	Q16665	reviewed	HIF1A_HUMAN	Hypoxia-inducible factor 1-alpha (HIF-1-alpha) (HIF1-alpha) (ARNT-interacting protein) (Basic-helix-loop-helix-PAS protein MOP1) (Class E basic helix-loop-helix protein 78) (bHLHe78) (Member of PAS protein 1) (PAS domain-containing protein 8)	HIF1A BHLHE78 MOP1 PASD8	Homo sapiens (Human)	826
D5KL86	D5KL86	unreviewed	D5KL86_HUMAN	Truncated p53	TP53	Homo sapiens (Human)	9
Q96KQ7	Q96KQ7	reviewed	EHMT2_HUMAN	Histone-lysine N-methyltransferase EHMT2 (EC 2.1.1.-) (EC 2.1.1.367) (Euchromatic histone-lysine N-methyltransferase 2) (HLA-B-associated transcript 8) (Histone H3-K9 methyltransferase 3) (H3-K9-HMTase 3) (Lysine N-methyltransferase 1C) (Protein G9a)	EHMT2 BAT8 C6orf30 G9A KMT1C NG36	Homo sapiens (Human)	1210
P04198	P04198	reviewed	MYCN_HUMAN	N-myc proto-oncogene protein (Class E basic helix-loop-helix protein 37) (bHLHe37)	MYCN BHLHE37 NMYC	Homo sapiens (Human)	464
Q9BXM7	Q9BXM7	reviewed	PINK1_HUMAN	Serine/threonine-protein kinase PINK1, mitochondrial (EC 2.7.11.1) (BRPK) (PTEN-induced putative kinase protein 1)	PINK1	Homo sapiens (Human)	581
P16220	P16220	reviewed	CREB1_HUMAN	Cyclic AMP-responsive element-binding protein 1 (CREB-1) (cAMP-responsive element-binding protein 1)	CREB1	Homo sapiens (Human)	327
P31749	P31749	reviewed	AKT1_HUMAN	RAC-alpha serine/threonine-protein kinase (EC 2.7.11.1) (Protein kinase B) (PKB) (Protein kinase B alpha) (PKB alpha) (Proto-oncogene c-Akt) (RAC-PK-alpha)	AKT1 PKB RAC	Homo sapiens (Human)	480
Q92597	Q92597	reviewed	NDRG1_HUMAN	Protein NDRG1 (Differentiation-related gene 1 protein) (DRG-1) (N-myc downstream-regulated gene 1 protein) (Nickel-specific induction protein Cap43) (Reducing agents and tunicamycin-responsive protein) (RTP) (Rit42)	NDRG1 CAP43 DRG1 RTP	Homo sapiens (Human)	394
P07288	P07288	reviewed	KLK3_HUMAN	Prostate-specific antigen (PSA) (EC 3.4.21.77) (Gamma-seminoprotein) (Seminin) (Kallikrein-3) (P-30 antigen) (Semenogelase)	KLK3 APS	Homo sapiens (Human)	261
P55075	P55075	reviewed	FGF8_HUMAN	Fibroblast growth factor 8 (FGF-8) (Androgen-induced growth factor) (AIGF) (Heparin-binding growth factor 8) (HBGF-8)	FGF8 AIGF	Homo sapiens (Human)	233
P38398	P38398	reviewed	BRCA1_HUMAN	Breast cancer type 1 susceptibility protein (EC 2.3.2.27) (RING finger protein 53) (RING-type E3 ubiquitin transferase BRCA1)	BRCA1 RNF53	Homo sapiens (Human)	1863
P42345	P42345	reviewed	MTOR_HUMAN	Serine/threonine-protein kinase mTOR (EC 2.7.11.1) (FK506-binding protein 12-rapamycin complex-associated protein 1) (FKBP12-rapamycin complex-associated protein) (Mammalian target of rapamycin) (mTOR) (Mechanistic target of rapamycin) (Rapamycin and FKBP12 target 1) (Rapamycin target protein 1)	MTOR FRAP FRAP1 FRAP2 RAFT1 RAPT1	Homo sapiens (Human)	2549
P23511	P23511	reviewed	NFYA_HUMAN	Nuclear transcription factor Y subunit alpha (CAAT box DNA-binding protein subunit A) (Nuclear transcription factor Y subunit A) (NF-YA)	NFYA	Homo sapiens (Human)	347
A0N9R9	A0N9R9	unreviewed	A0N9R9_HUMAN	Insulin-like growth factor type II receptor	IGF2R	Homo sapiens (Human)	18
P15531	P15531	reviewed	NDKA_HUMAN	Nucleoside diphosphate kinase A (NDK A) (NDP kinase A) (EC 2.7.4.6) (Granzyme A-activated DNase) (GAAD) (Metastasis inhibition factor nm23) (NM23-H1) (Tumor metastatic process-associated protein)	NME1 NDPKA NM23	Homo sapiens (Human)	152
O76093	O76093	reviewed	FGF18_HUMAN	Fibroblast growth factor 18 (FGF-18) (zFGF5)	FGF18 UNQ420/PRO856	Homo sapiens (Human)	207
P03950	P03950	reviewed	ANGI_HUMAN	Angiogenin (EC 3.1.27.-) (Ribonuclease 5) (RNase 5)	ANG RNASE5	Homo sapiens (Human)	147
P78346	P78346	reviewed	RPP30_HUMAN	Ribonuclease P protein subunit p30 (RNaseP protein p30) (RNase P subunit 2)	RPP30 RNASEP2	Homo sapiens (Human)	268
P01106	P01106	reviewed	MYC_HUMAN	Myc proto-oncogene protein (Class E basic helix-loop-helix protein 39) (bHLHe39) (Proto-oncogene c-Myc) (Transcription factor p64)	MYC BHLHE39	Homo sapiens (Human)	454
Q00987	Q00987	reviewed	MDM2_HUMAN	E3 ubiquitin-protein ligase Mdm2 (EC 2.3.2.27) (Double minute 2 protein) (Hdm2) (Oncoprotein Mdm2) (RING-type E3 ubiquitin transferase Mdm2) (p53-binding protein Mdm2)	MDM2	Homo sapiens (Human)	491
Q8TEY5	Q8TEY5	reviewed	CR3L4_HUMAN	Cyclic AMP-responsive element-binding protein 3-like protein 4 (cAMP-responsive element-binding protein 3-like protein 4) (Androgen-induced basic leucine zipper protein) (AIbZIP) (Attaching to CRE-like 1) (ATCE1) (Cyclic AMP-responsive element-binding protein 4) (CREB-4) (cAMP-responsive element-binding protein 4) (Transcript induced in spermiogenesis protein 40) (Tisp40) (hJAL) [Cleaved into: Processed cyclic AMP-responsive element-binding protein 3-like protein 4]	CREB3L4 AIBZIP CREB4 JAL	Homo sapiens (Human)	395
Q8CJG0	Q8CJG0	reviewed	AGO2_MOUSE	Protein argonaute-2 (Argonaute2) (mAgo2) (EC 3.1.26.n2) (Argonaute RISC catalytic component 2) (Eukaryotic translation initiation factor 2C 2) (eIF-2C 2) (eIF2C 2) (Piwi/argonaute family protein meIF2C2) (Protein slicer)	Ago2 Eif2c2 Kiaa4215	Mus musculus (Mouse)	860
O75530	O75530	reviewed	EED_HUMAN	Polycomb protein EED (hEED) (Embryonic ectoderm development protein) (WD protein associating with integrin cytoplasmic tails 1) (WAIT-1)	EED	Homo sapiens (Human)	441
P48431	P48431	reviewed	SOX2_HUMAN	Transcription factor SOX-2	SOX2	Homo sapiens (Human)	317
O95096	O95096	reviewed	NKX22_HUMAN	Homeobox protein Nkx-2.2 (Homeobox protein NK-2 homolog B)	NKX2-2 NKX2.2 NKX2B	Homo sapiens (Human)	273
O96828	O96828	unreviewed	O96828_DROME	EG:EG0003.2 protein (Fbgn0014870;psi protein)	Psi ec EG:EG0003.2 CG8912	Drosophila melanogaster (Fruit fly)	806
P43332	P43332	reviewed	SNRPA_DROME	U1 small nuclear ribonucleoprotein A (U1 snRNP A) (U1-A) (U1A) (Sex determination protein snf)	snf D25 fs(1)1621 liz CG4528	Drosophila melanogaster (Fruit fly)	216
Q32KG2	Q32KG2	unreviewed	Q32KG2_DROME	Cyclin-H	CycH	Drosophila melanogaster (Fruit fly)	323
Q9V3W7	Q9V3W7	unreviewed	Q9V3W7_DROME	LD40489p (SR family splicing factor) (SR family splicing factor SF2) (Splicing factor 2, isoform A) (Splicing factor 2, isoform B)	SF2 154911_at ASF ASF/SF2 cg6987 dASF Dmel\CG6987 dmSF2/p28 dSF2/ASF dSRp30 p28/SF2 SRp30 SRSF1 CG6987 Dmel_CG6987	Drosophila melanogaster (Fruit fly)	255
U5IQE4	U5IQE4	unreviewed	U5IQE4_HUMAN	MHC class II antigen	HLA-DQB1	Homo sapiens (Human)	89
P19447	P19447	reviewed	ERCC3_HUMAN	General transcription and DNA repair factor IIH helicase subunit XPB (TFIIH subunit XPB) (EC 3.6.4.12) (Basic transcription factor 2 89 kDa subunit) (BTF2 p89) (DNA excision repair protein ERCC-3) (DNA repair protein complementing XP-B cells) (TFIIH basal transcription factor complex 89 kDa subunit) (TFIIH 89 kDa subunit) (TFIIH p89) (Xeroderma pigmentosum group B-complementing protein)	ERCC3 XPB XPBC	Homo sapiens (Human)	782
Q7L014	Q7L014	reviewed	DDX46_HUMAN	Probable ATP-dependent RNA helicase DDX46 (EC 3.6.4.13) (DEAD box protein 46) (PRP5 homolog)	DDX46 KIAA0801	Homo sapiens (Human)	1031
G9HW14	G9HW14	unreviewed	G9HW14_HUMAN	MHC class II antigen	HLA-DRB1	Homo sapiens (Human)	89
Q9NVP2	Q9NVP2	reviewed	ASF1B_HUMAN	Histone chaperone ASF1B (Anti-silencing function protein 1 homolog B) (hAsf1) (hAsf1b) (CCG1-interacting factor A-II) (CIA-II) (hCIA-II)	ASF1B	Homo sapiens (Human)	202
J3KTL2	J3KTL2	unreviewed	J3KTL2_HUMAN	Serine/arginine-rich splicing factor 1 (Splicing factor, arginine/serine-rich 1)	SRSF1 SFRS1 hCG_1774411	Homo sapiens (Human)	253
P32605	P32605	reviewed	RU1A_YEAST	U1 small nuclear ribonucleoprotein A (U1 snRNP A) (U1-A) (U1A) (Mutant U1 die protein 1)	MUD1 YBR119W YBR0915	Saccharomyces cerevisiae (strain ATCC 204508 / S288c) (Baker's yeast)	298
P33203	P33203	reviewed	PRP40_YEAST	Pre-mRNA-processing protein PRP40	PRP40 YKL012W YKL165	Saccharomyces cerevisiae (strain ATCC 204508 / S288c) (Baker's yeast)	583
P39682	P39682	reviewed	PRP39_YEAST	Pre-mRNA-processing factor 39	PRP39 YML046W YM9827.06	Saccharomyces cerevisiae (strain ATCC 204508 / S288c) (Baker's yeast)	629
P53207	P53207	reviewed	SNU71_YEAST	U1 small nuclear ribonucleoprotein component SNU71	SNU71 YGR013W	Saccharomyces cerevisiae (strain ATCC 204508 / S288c) (Baker's yeast)	620
Q00539	Q00539	reviewed	NAM8_YEAST	Protein NAM8 (Nuclear accommodation of mitochondria protein 8) (U1 snRNP component NAM8)	NAM8 MRE2 MUD15 YHR086W	Saccharomyces cerevisiae (strain ATCC 204508 / S288c) (Baker's yeast)	523
Q03776	Q03776	reviewed	PRP42_YEAST	U1 small nuclear ribonucleoprotein component PRP42 (U1 snRNP protein PRP42) (65 kDa snRNP protein) (Pre-mRNA-processing factor 42)	PRP42 MUD16 SNU65 YDR235W YD8419.02	Saccharomyces cerevisiae (strain ATCC 204508 / S288c) (Baker's yeast)	544
Q03782	Q03782	reviewed	SNU56_YEAST	56 kDa U1 small nuclear ribonucleoprotein component	SNU56 MUD10 YDR240C	Saccharomyces cerevisiae (strain ATCC 204508 / S288c) (Baker's yeast)	492
Q05900	Q05900	reviewed	RU1C_YEAST	U1 small nuclear ribonucleoprotein C (U1 snRNP C) (U1-C) (U1C)	YHC1 YLR298C L8003.21	Saccharomyces cerevisiae (strain ATCC 204508 / S288c) (Baker's yeast)	231
Q07508	Q07508	reviewed	LUC7_YEAST	Protein LUC7	LUC7 EPE1 EXM2 YDL087C	Saccharomyces cerevisiae (strain ATCC 204508 / S288c) (Baker's yeast)	261
Q9V4Q8	Q9V4Q8	reviewed	RU2A_DROME	Probable U2 small nuclear ribonucleoprotein A' (U2 snRNP A')	U2A CG1406	Drosophila melanogaster (Fruit fly)	265
O08848	O08848	reviewed	RO60_MOUSE	RNA-binding protein Ro60 (60 kDa SS-A/Ro ribonucleoprotein) (60 kDa Ro protein) (60 kDa ribonucleoprotein Ro) (RoRNP) (TROVE domain family member 2)	RO60 Ssa2 Trove2	Mus musculus (Mouse)	538
Q8K4Z5	Q8K4Z5	reviewed	SF3A1_MOUSE	Splicing factor 3A subunit 1 (SF3a120)	Sf3a1	Mus musculus (Mouse)	791
O95319	O95319	reviewed	CELF2_HUMAN	CUGBP Elav-like family member 2 (CELF-2) (Bruno-like protein 3) (CUG triplet repeat RNA-binding protein 2) (CUG-BP2) (CUG-BP- and ETR-3-like factor 2) (ELAV-type RNA-binding protein 3) (ETR-3) (Neuroblastoma apoptosis-related RNA-binding protein) (hNAPOR) (RNA-binding protein BRUNOL-3)	CELF2 BRUNOL3 CUGBP2 ETR3 NAPOR	Homo sapiens (Human)	508
P19736	P19736	reviewed	PRP9_YEAST	Pre-mRNA-splicing factor PRP9	PRP9 YDL030W D2773	Saccharomyces cerevisiae (strain ATCC 204508 / S288c) (Baker's yeast)	530
P21372	P21372	reviewed	PRP5_YEAST	Pre-mRNA-processing ATP-dependent RNA helicase PRP5 (EC 3.6.4.13)	PRP5 RNA5 YBR237W YBR1603	Saccharomyces cerevisiae (strain ATCC 204508 / S288c) (Baker's yeast)	849
P32524	P32524	reviewed	PRP21_YEAST	Pre-mRNA-splicing factor PRP21	PRP21 SPP91 YJL203W J0322	Saccharomyces cerevisiae (strain ATCC 204508 / S288c) (Baker's yeast)	280
P40565	P40565	reviewed	IST3_YEAST	U2 snRNP component IST3 (Increased sodium tolerance protein 3) (U2 snRNP protein SNU17)	IST3 SNU17 YIR005W YIB5W	Saccharomyces cerevisiae (strain ATCC 204508 / S288c) (Baker's yeast)	148
P49955	P49955	reviewed	SF3B1_YEAST	U2 snRNP component HSH155	HSH155 YMR288W YM8021.14	Saccharomyces cerevisiae (strain ATCC 204508 / S288c) (Baker's yeast)	971
Q02554	Q02554	reviewed	CUS1_YEAST	Cold sensitive U2 snRNA suppressor 1	CUS1 YMR240C YM9408.02C	Saccharomyces cerevisiae (strain ATCC 204508 / S288c) (Baker's yeast)	436
Q04693	Q04693	reviewed	RSE1_YEAST	Pre-mRNA-splicing factor RSE1 (RNA splicing and ER to Golgi transport factor 1) (Spliceosome-associated protein 130)	RSE1 SAP130 YML049C YM9827.03C	Saccharomyces cerevisiae (strain ATCC 204508 / S288c) (Baker's yeast)	1361
Q07350	Q07350	reviewed	PRP11_YEAST	Pre-mRNA-splicing factor PRP11	PRP11 PRP10 RNA11 YDL043C D2711	Saccharomyces cerevisiae (strain ATCC 204508 / S288c) (Baker's yeast)	266
Q08963	Q08963	reviewed	RU2A_YEAST	U2 small nuclear ribonucleoprotein A' (U2 snRNP A') (Looks exceptionally like U2A protein 1)	LEA1 YPL213W	Saccharomyces cerevisiae (strain ATCC 204508 / S288c) (Baker's yeast)	238
Q99181	Q99181	reviewed	HSH49_YEAST	Protein HSH49	HSH49 YOR319W O6142	Saccharomyces cerevisiae (strain ATCC 204508 / S288c) (Baker's yeast)	213
P53941	P53941	reviewed	IMP4_YEAST	U3 small nucleolar ribonucleoprotein protein IMP4 (U3 snoRNP protein IMP4) (Interacting with MPP10 protein 4)	IMP4 YNL075W N2353	Saccharomyces cerevisiae (strain ATCC 204508 / S288c) (Baker's yeast)	290
Q91WM3	Q91WM3	reviewed	U3IP2_MOUSE	U3 small nucleolar RNA-interacting protein 2 (RRP9 homolog) (U3 small nucleolar ribonucleoprotein-associated 55 kDa protein) (U3 snoRNP-associated 55 kDa protein) (U3-55K)	Rrp9 Rnu3ip2 U3-55k	Mus musculus (Mouse)	475
O43172	O43172	reviewed	PRP4_HUMAN	U4/U6 small nuclear ribonucleoprotein Prp4 (PRP4 homolog) (hPrp4) (U4/U6 snRNP 60 kDa protein) (WD splicing factor Prp4)	PRPF4 PRP4	Homo sapiens (Human)	522
P83876	P83876	reviewed	TXN4A_HUMAN	Thioredoxin-like protein 4A (DIM1 protein homolog) (Spliceosomal U5 snRNP-specific 15 kDa protein) (Thioredoxin-like U5 snRNP protein U5-15kD)	TXNL4A DIM1 TXNL4	Homo sapiens (Human)	142
Q6IBM8	Q6IBM8	unreviewed	Q6IBM8_HUMAN	116 kDa U5 small nuclear ribonucleoprotein component (U5 snRNP-specific protein, 116 kDa)	U5-116KD	Homo sapiens (Human)	972
P13393	P13393	reviewed	TBP_YEAST	TATA-box-binding protein (TATA sequence-binding protein) (TBP) (TATA-binding factor) (TATA-box factor) (Transcription factor D) (Transcription initiation factor TFIID TBP subunit)	SPT15 BTF1 TBP1 YER148W	Saccharomyces cerevisiae (strain ATCC 204508 / S288c) (Baker's yeast)	240
Q9Y6Y0	Q9Y6Y0	reviewed	NS1BP_HUMAN	Influenza virus NS1A-binding protein (NS1-BP) (NS1-binding protein) (Aryl hydrocarbon receptor-associated protein 3) (Kelch-like protein 39)	IVNS1ABP ARA3 FLARA3 KIAA0850 KLHL39 NS1 NS1BP HSPC068	Homo sapiens (Human)	642
P02828	P02828	reviewed	HSP83_DROME	Heat shock protein 83 (HSP 82)	Hsp83 Hsp82 Hsp90 CG1242	Drosophila melanogaster (Fruit fly)	717
P19474	P19474	reviewed	RO52_HUMAN	E3 ubiquitin-protein ligase TRIM21 (EC 2.3.2.27) (52 kDa Ro protein) (52 kDa ribonucleoprotein autoantigen Ro/SS-A) (RING finger protein 81) (RING-type E3 ubiquitin transferase TRIM21) (Ro(SS-A)) (Sjoegren syndrome type A antigen) (SS-A) (Tripartite motif-containing protein 21)	TRIM21 RNF81 RO52 SSA1	Homo sapiens (Human)	475
Q9JKF1	Q9JKF1	reviewed	IQGA1_MOUSE	Ras GTPase-activating-like protein IQGAP1	Iqgap1	Mus musculus (Mouse)	1657
O76094	O76094	reviewed	SRP72_HUMAN	Signal recognition particle subunit SRP72 (SRP72) (Signal recognition particle 72 kDa protein)	SRP72	Homo sapiens (Human)	671
Q9VSS2	Q9VSS2	reviewed	SRP68_DROME	Signal recognition particle subunit SRP68 (SRP68) (Signal recognition particle 68 kDa protein)	Srp68 CG5064	Drosophila melanogaster (Fruit fly)	604
Q8T3P8	Q8T3P8	unreviewed	Q8T3P8_DROME	Signal recognition particle 54 kDa protein	Srp54k CG4659	Drosophila melanogaster (Fruit fly)	569
P05084	P05084	reviewed	HUNB_DROME	Protein hunchback	hb CG9786	Drosophila melanogaster (Fruit fly)	758
P26017	P26017	reviewed	PC_DROME	Polycomb group protein Pc (Protein polycomb)	Pc CG7618	Drosophila melanogaster (Fruit fly)	390
Q9V429	Q9V429	reviewed	THIO2_DROME	Thioredoxin-2 (DmTrx-2)	Trx-2 CG31884	Drosophila melanogaster (Fruit fly)	106
B1IVL4	B1IVL4	reviewed	SSRP_ECOLC	SsrA-binding protein (Small protein B)	smpB EcolC_1064	Escherichia coli (strain ATCC 8739 / DSM 1576 / NBRC 3972 / NCIMB 8545 / WDCM 00012 / Crooks)	160
P42184	P42184	reviewed	PRSA_ECOLX	PRS fimbrial major pilin protein (PRS pili)	prsA	Escherichia coli	161
P25555	P25555	reviewed	GBP2_YEAST	Serine/arginine (SR)-type shuttling mRNA binding protein GBP2 (Polyadenylate-binding protein GBP2) (RAP1 localization factor 6) (Single-strand telomeric DNA-binding protein GBP2) (G-strand-binding protein 2)	GBP2 RLF6 YCL011C YCL11C	Saccharomyces cerevisiae (strain ATCC 204508 / S288c) (Baker's yeast)	427
P38199	P38199	reviewed	HEK2_YEAST	Heterogeneous nuclear rnp K-like protein 2 (KH domain-containing protein 1)	HEK2 KHD1 YBL032W YBL0418	Saccharomyces cerevisiae (strain ATCC 204508 / S288c) (Baker's yeast)	381
Q99383	Q99383	reviewed	HRP1_YEAST	Nuclear polyadenylated RNA-binding protein 4 (Cleavage factor IB) (CFIB) (Heterogeneous nuclear ribonucleoprotein 1)	HRP1 NAB4 NAB5 YOL123W	Saccharomyces cerevisiae (strain ATCC 204508 / S288c) (Baker's yeast)	534
Q99257	Q99257	reviewed	MEX67_YEAST	mRNA export factor MEX67	MEX67 YPL169C P2520	Saccharomyces cerevisiae (strain ATCC 204508 / S288c) (Baker's yeast)	599
P47047	P47047	reviewed	MTR4_YEAST	ATP-dependent RNA helicase DOB1 (EC 3.6.4.13) (mRNA transport regulator MTR4)	MTR4 DOB1 YJL050W J1158	Saccharomyces cerevisiae (strain ATCC 204508 / S288c) (Baker's yeast)	1073
Q15742	Q15742	reviewed	NAB2_HUMAN	NGFI-A-binding protein 2 (EGR-1-binding protein 2) (Melanoma-associated delayed early response protein) (Protein MADER)	NAB2 MADER	Homo sapiens (Human)	525
P04147	P04147	reviewed	PABP_YEAST	Polyadenylate-binding protein, cytoplasmic and nuclear (PABP) (Poly(A)-binding protein) (ARS consensus-binding protein ACBP-67) (Polyadenylate tail-binding protein)	PAB1 YER165W	Saccharomyces cerevisiae (strain ATCC 204508 / S288c) (Baker's yeast)	577
P53632	P53632	reviewed	PAP2_YEAST	Poly(A) RNA polymerase protein 2 (EC 2.7.7.19) (DNA polymerase kappa) (DNA polymerase sigma) (Topoisomerase 1-related protein TRF4)	PAP2 TRF4 YOL115W HRC584 O0716	Saccharomyces cerevisiae (strain ATCC 204508 / S288c) (Baker's yeast)	584
P35207	P35207	reviewed	SKI2_YEAST	Antiviral helicase SKI2 (EC 3.6.4.13) (Superkiller protein 2)	SKI2 YLR398C L8084.17	Saccharomyces cerevisiae (strain ATCC 204508 / S288c) (Baker's yeast)	1287
P34160	P34160	reviewed	NCBP1_YEAST	Nuclear cap-binding protein complex subunit 1 (80 kDa nuclear cap-binding protein) (CBP80) (NCBP 80 kDa subunit) (Glycolysis regulation protein 3) (Protein SUT1) (Suppressor of TOP1 protein)	STO1 CBC1 CBP80 GCR3 SUT1 YMR125W YM8564.07 YM9553.01	Saccharomyces cerevisiae (strain ATCC 204508 / S288c) (Baker's yeast)	861
P53552	P53552	reviewed	THO2_YEAST	THO complex subunit 2 (Low dye-binding protein 5) (THO complex subunit RLR1) (Zinc-regulated gene 13 protein)	THO2 LDB5 RLR1 ZRG13 YNL139C N1209 N1835	Saccharomyces cerevisiae (strain ATCC 204508 / S288c) (Baker's yeast)	1597
Q8IZH2	Q8IZH2	reviewed	XRN1_HUMAN	5'-3' exoribonuclease 1 (EC 3.1.13.-) (Strand-exchange protein 1 homolog)	XRN1 SEP1	Homo sapiens (Human)	1706
P10081	P10081	reviewed	IF4A_YEAST	ATP-dependent RNA helicase eIF4A (EC 3.6.4.13) (Eukaryotic initiation factor 4A) (eIF-4A) (Stimulator factor I 37 kDa component) (Translation initiation factor 1/2) (p37)	TIF1 TIF41A YKR059W; TIF2 TIF41B YJL138C J0660	Saccharomyces cerevisiae (strain ATCC 204508 / S288c) (Baker's yeast)	395
J9PH39	J9PH39	unreviewed	J9PH39_HUMAN	Tumor necrosis factor receptor superfamily member 1A (Tumor necrosis factor receptor 1) (Tumor necrosis factor receptor type I) (p55) (p60)	TNFRSF1A	Homo sapiens (Human)	347
A8MZG1	A8MZG1	unreviewed	A8MZG1_HUMAN	Thrombospondin 1	THBS1	Homo sapiens (Human)	94
P05121	P05121	reviewed	PAI1_HUMAN	Plasminogen activator inhibitor 1 (PAI) (PAI-1) (Endothelial plasminogen activator inhibitor) (Serpin E1)	SERPINE1 PAI1 PLANH1	Homo sapiens (Human)	402
Q4TT34	Q4TT34	unreviewed	Q4TT34_HUMAN	Nucleoside diphosphate kinase (EC 2.7.4.6)	NME4	Homo sapiens (Human)	195
G3V286	G3V286	unreviewed	G3V286_HUMAN	NFKB inhibitor alpha	NFKBIA	Homo sapiens (Human)	227
P19838	P19838	reviewed	NFKB1_HUMAN	Nuclear factor NF-kappa-B p105 subunit (DNA-binding factor KBF1) (EBP-1) (Nuclear factor of kappa light polypeptide gene enhancer in B-cells 1) [Cleaved into: Nuclear factor NF-kappa-B p50 subunit]	NFKB1	Homo sapiens (Human)	968
Q13330	Q13330	reviewed	MTA1_HUMAN	Metastasis-associated protein MTA1	MTA1	Homo sapiens (Human)	715
Q9NQ41	Q9NQ41	unreviewed	Q9NQ41_HUMAN	Melanoma adhesion molecule	MCAM	Homo sapiens (Human)	46
P05412	P05412	reviewed	JUN_HUMAN	Transcription factor Jun (Activator protein 1) (AP1) (Proto-oncogene c-Jun) (Transcription factor AP-1 subunit Jun) (V-jun avian sarcoma virus 17 oncogene homolog) (p39)	JUN	Homo sapiens (Human)	331
Q9UM22	Q9UM22	reviewed	EPDR1_HUMAN	Mammalian ependymin-related protein 1 (MERP-1) (Upregulated in colorectal cancer gene 1 protein)	EPDR1 MERP1 UCC1	Homo sapiens (Human)	224
Q01094	Q01094	reviewed	E2F1_HUMAN	Transcription factor E2F1 (E2F-1) (PBR3) (Retinoblastoma-associated protein 1) (RBAP-1) (Retinoblastoma-binding protein 3) (RBBP-3) (pRB-binding protein E2F-1)	E2F1 RBBP3	Homo sapiens (Human)	437
A0A024R2Q3	A0A024R2Q3	unreviewed	A0A024R2Q3_HUMAN	Catenin (Cadherin-associated protein), beta 1, 88kDa, isoform CRA_a	CTNNB1 hCG_27815	Homo sapiens (Human)	781
P16070	P16070	reviewed	CD44_HUMAN	CD44 antigen (CDw44) (Epican) (Extracellular matrix receptor III) (ECMR-III) (GP90 lymphocyte homing/adhesion receptor) (HUTCH-I) (Heparan sulfate proteoglycan) (Hermes antigen) (Hyaluronate receptor) (Phagocytic glycoprotein 1) (PGP-1) (Phagocytic glycoprotein I) (PGP-I) (CD antigen CD44)	CD44 LHR MDU2 MDU3 MIC4	Homo sapiens (Human)	742
O15392	O15392	reviewed	BIRC5_HUMAN	Baculoviral IAP repeat-containing protein 5 (Apoptosis inhibitor 4) (Apoptosis inhibitor survivin)	BIRC5 API4 IAP4	Homo sapiens (Human)	142
Q92900	Q92900	reviewed	RENT1_HUMAN	Regulator of nonsense transcripts 1 (EC 3.6.4.12) (EC 3.6.4.13) (ATP-dependent helicase RENT1) (Nonsense mRNA reducing factor 1) (NORF1) (Up-frameshift suppressor 1 homolog) (hUpf1)	UPF1 KIAA0221 RENT1	Homo sapiens (Human)	1129
Q8BIF2	Q8BIF2	reviewed	RFOX3_MOUSE	RNA binding protein fox-1 homolog 3 (Fox-1 homolog C) (Hexaribonucleotide-binding protein 3) (Fox-3) (Neuronal nuclei antigen) (NeuN antigen)	Rbfox3 D11Bwg0517e Hrnbp3	Mus musculus (Mouse)	374
Q8R003	Q8R003	reviewed	MBNL3_MOUSE	Muscleblind-like protein 3 (Cys3His CCG1-required protein) (Muscleblind-like X-linked protein) (Protein MCHCR)	Mbnl3 Chcr Mbxl	Mus musculus (Mouse)	342
Q92833	Q92833	reviewed	JARD2_HUMAN	Protein Jumonji (Jumonji/ARID domain-containing protein 2)	JARID2 JMJ	Homo sapiens (Human)	1246
P69566	P69566	reviewed	RANB9_MOUSE	Ran-binding protein 9 (RanBP9) (B-cell antigen receptor Ig beta-associated protein 1) (IBAP-1) (Ran-binding protein M) (RanBPM)	Ranbp9 Ranbpm	Mus musculus (Mouse)	653
Q5VZF2	Q5VZF2	reviewed	MBNL2_HUMAN	Muscleblind-like protein 2 (Muscleblind-like protein 1) (Muscleblind-like protein-like) (Muscleblind-like protein-like 39)	MBNL2 MBLL MBLL39 MLP1	Homo sapiens (Human)	373
Q5T481	Q5T481	reviewed	RBM20_HUMAN	RNA-binding protein 20 (RNA-binding motif protein 20)	RBM20	Homo sapiens (Human)	1227
P38432	P38432	reviewed	COIL_HUMAN	Coilin (p80-coilin)	COIL CLN80	Homo sapiens (Human)	576
Q93062	Q93062	reviewed	RBPMS_HUMAN	RNA-binding protein with multiple splicing (RBP-MS) (Heart and RRM expressed sequence) (Hermes)	RBPMS HERMES	Homo sapiens (Human)	196
Q6ZN17	Q6ZN17	reviewed	LN28B_HUMAN	Protein lin-28 homolog B (Lin-28B)	LIN28B CSDD2	Homo sapiens (Human)	250
Q8TB72	Q8TB72	reviewed	PUM2_HUMAN	Pumilio homolog 2 (Pumilio-2)	PUM2 KIAA0235 PUMH2	Homo sapiens (Human)	1066
O75821	O75821	reviewed	EIF3G_HUMAN	Eukaryotic translation initiation factor 3 subunit G (eIF3g) (Eukaryotic translation initiation factor 3 RNA-binding subunit) (eIF-3 RNA-binding subunit) (Eukaryotic translation initiation factor 3 subunit 4) (eIF-3-delta) (eIF3 p42) (eIF3 p44)	EIF3G EIF3S4	Homo sapiens (Human)	320
K7EKN9	K7EKN9	unreviewed	K7EKN9_HUMAN	Trinucleotide repeat containing adaptor 6C	TNRC6C	Homo sapiens (Human)	95
H3BRT3	H3BRT3	unreviewed	H3BRT3_HUMAN	Trinucleotide repeat containing adaptor 6A	TNRC6A	Homo sapiens (Human)	160
A0A024R1T4	A0A024R1T4	unreviewed	A0A024R1T4_HUMAN	Trinucleotide repeat containing 6B, isoform CRA_b	TNRC6B hCG_41115	Homo sapiens (Human)	1527
Q86V81	Q86V81	reviewed	THOC4_HUMAN	THO complex subunit 4 (Tho4) (Ally of AML-1 and LEF-1) (Aly/REF export factor) (Transcriptional coactivator Aly/REF) (bZIP-enhancing factor BEF)	ALYREF ALY BEF THOC4	Homo sapiens (Human)	257
Q07807	Q07807	reviewed	PUF3_YEAST	mRNA-binding protein PUF3 (Pumilio homology domain family member 3)	PUF3 YLL013C L1325	Saccharomyces cerevisiae (strain ATCC 204508 / S288c) (Baker's yeast)	879
A0AV96	A0AV96	reviewed	RBM47_HUMAN	RNA-binding protein 47 (RNA-binding motif protein 47)	RBM47	Homo sapiens (Human)	593
Q8TEK3	Q8TEK3	reviewed	DOT1L_HUMAN	Histone-lysine N-methyltransferase, H3 lysine-79 specific (EC 2.1.1.360) (DOT1-like protein) (Histone H3-K79 methyltransferase) (H3-K79-HMTase) (Lysine N-methyltransferase 4)	DOT1L KIAA1814 KMT4	Homo sapiens (Human)	1537
B0QYK0	B0QYK0	unreviewed	B0QYK0_HUMAN	EWS RNA binding protein 1	EWSR1	Homo sapiens (Human)	618
P31483	P31483	reviewed	TIA1_HUMAN	Cytotoxic granule associated RNA binding protein TIA1 (Nucleolysin TIA-1 isoform p40) (RNA-binding protein TIA-1) (T-cell-restricted intracellular antigen-1) (TIA-1) (p40-TIA-1)	TIA1	Homo sapiens (Human)	386
E7ETC0	E7ETC0	unreviewed	E7ETC0_HUMAN	TIA1 cytotoxic granule associated RNA binding protein like 1	TIAL1	Homo sapiens (Human)	135
A0A075B7F4	A0A075B7E4	unreviewed	A0A075B7E4_HUMAN	TATA-box binding protein associated factor 15	TAF15	Homo sapiens (Human)	212
