From	Entry	Reviewed	Entry Name	Protein names	Gene Names	Organism	Length
Q62241	Q62241	reviewed	RU1C_MOUSE	U1 small nuclear ribonucleoprotein C (U1 snRNP C) (U1-C) (U1C)	Snrpc Snrp1c	Mus musculus (Mouse)	159
Q62376	Q62376	reviewed	RU17_MOUSE	U1 small nuclear ribonucleoprotein 70 kDa (U1 snRNP 70 kDa) (U1-70K) (snRNP70)	Snrnp70 Snrp70	Mus musculus (Mouse)	448
Q00916	Q00916	reviewed	RU17_YEAST	U1 small nuclear ribonucleoprotein 70 kDa homolog (U1 70K) (U1 snRNP 70 kDa homolog) (U1-70K) (U1 small nuclear ribonucleoprotein SNP1) (U1 snRNP protein SNP1)	SNP1 YIL061C	Saccharomyces cerevisiae (strain ATCC 204508 / S288c) (Baker's yeast)	300
Q9Y5B6	Q9Y5B6	reviewed	PAXB1_HUMAN	PAX3- and PAX7-binding protein 1 (GC-rich sequence DNA-binding factor 1)	PAXBP1 C21orf66 GCFC GCFC1	Homo sapiens (Human)	917
P27348	P27348	reviewed	1433T_HUMAN	14-3-3 protein theta (14-3-3 protein T-cell) (14-3-3 protein tau) (Protein HS1)	YWHAQ	Homo sapiens (Human)	245
Q9NWB6	Q9NWB6	reviewed	ARGL1_HUMAN	Arginine and glutamate-rich protein 1	ARGLU1	Homo sapiens (Human)	273
Q2TBE0	Q2TBE0	reviewed	C19L2_HUMAN	CWF19-like protein 2	CWF19L2	Homo sapiens (Human)	894
Q9NZ63	Q9NZ63	reviewed	TLS1_HUMAN	Splicing factor C9orf78 (Hepatocellular carcinoma-associated antigen 59)	C9orf78 HCA59	Homo sapiens (Human)	289
P19784	P19784	reviewed	CSK22_HUMAN	Casein kinase II subunit alpha' (CK II alpha') (EC 2.7.11.1)	CSNK2A2 CK2A2	Homo sapiens (Human)	350
P67870	P67870	reviewed	CSK2B_HUMAN	Casein kinase II subunit beta (CK II beta) (Phosvitin) (Protein G5a)	CSNK2B CK2N G5A	Homo sapiens (Human)	215
Q9NVM6	Q9NVM6	reviewed	DJC17_HUMAN	DnaJ homolog subfamily C member 17	DNAJC17	Homo sapiens (Human)	304
P49916	P49916	reviewed	DNLI3_HUMAN	DNA ligase 3 (EC 6.5.1.1) (DNA ligase III) (Polydeoxyribonucleotide synthase [ATP] 3)	LIG3	Homo sapiens (Human)	1009
P15311	P15311	reviewed	EZRI_HUMAN	Ezrin (Cytovillin) (Villin-2) (p81)	EZR VIL2	Homo sapiens (Human)	586
P22087	P22087	reviewed	FBRL_HUMAN	rRNA 2'-O-methyltransferase fibrillarin (EC 2.1.1.-) (34 kDa nucleolar scleroderma antigen) (Histone-glutamine methyltransferase) (U6 snRNA 2'-O-methyltransferase fibrillarin)	FBL FIB1 FLRN	Homo sapiens (Human)	321
P62942	P62942	reviewed	FKB1A_HUMAN	Peptidyl-prolyl cis-trans isomerase FKBP1A (PPIase FKBP1A) (EC 5.2.1.8) (12 kDa FK506-binding protein) (12 kDa FKBP) (FKBP-12) (Calstabin-1) (FK506-binding protein 1A) (FKBP-1A) (Immunophilin FKBP12) (Rotamase)	FKBP1A FKBP1 FKBP12	Homo sapiens (Human)	108
O43719	O43719	reviewed	HTSF1_HUMAN	HIV Tat-specific factor 1 (Tat-SF1)	HTATSF1	Homo sapiens (Human)	755
Q9Y2F5	Q9Y2F5	reviewed	ICE1_HUMAN	Little elongation complex subunit 1 (Interactor of little elongator complex ELL subunit 1)	ICE1 KIAA0947	Homo sapiens (Human)	2266
P40925	P40925	reviewed	MDHC_HUMAN	Malate dehydrogenase, cytoplasmic (EC 1.1.1.37) (Aromatic alpha-keto acid reductase) (KAR) (EC 1.1.1.96) (Cytosolic malate dehydrogenase)	MDH1 MDHA	Homo sapiens (Human)	334
Q9BWU0	Q9BWU0	reviewed	NADAP_HUMAN	Kanadaptin (Human lung cancer oncogene 3 protein) (HLC-3) (Kidney anion exchanger adapter protein) (Solute carrier family 4 anion exchanger member 1 adapter protein)	SLC4A1AP HLC3	Homo sapiens (Human)	796
P55769	P55769	reviewed	NH2L1_HUMAN	NHP2-like protein 1 (High mobility group-like nuclear protein 2 homolog 1) (OTK27) (SNU13 homolog) (hSNU13) (U4/U6.U5 small nuclear ribonucleoprotein SNU13) (U4/U6.U5 tri-snRNP 15.5 kDa protein) [Cleaved into: NHP2-like protein 1, N-terminally processed]	SNU13 NHP2L1	Homo sapiens (Human)	128
O95340	O95340	reviewed	PAPS2_HUMAN	Bifunctional 3'-phosphoadenosine 5'-phosphosulfate synthase 2 (PAPS synthase 2) (PAPSS 2) (Sulfurylase kinase 2) (SK 2) (SK2) [Includes: Sulfate adenylyltransferase (EC 2.7.7.4) (ATP-sulfurylase) (Sulfate adenylate transferase) (SAT); Adenylyl-sulfate kinase (EC 2.7.1.25) (3'-phosphoadenosine-5'-phosphosulfate synthase) (APS kinase) (Adenosine-5'-phosphosulfate 3'-phosphotransferase) (Adenylylsulfate 3'-phosphotransferase)]	PAPSS2 ATPSK2	Homo sapiens (Human)	614
Q8WW12	Q8WW12	reviewed	PCNP_HUMAN	PEST proteolytic signal-containing nuclear protein (PCNP) (PEST-containing nuclear protein)	PCNP	Homo sapiens (Human)	178
O60508	O60508	reviewed	PRP17_HUMAN	Pre-mRNA-processing factor 17 (Cell division cycle 40 homolog) (EH-binding protein 3) (Ehb3) (PRP17 homolog) (hPRP17)	CDC40 EHB3 PRP17 PRPF17	Homo sapiens (Human)	579
P08579	P08579	reviewed	RU2B_HUMAN	U2 small nuclear ribonucleoprotein B'' (U2 snRNP B'')	SNRPB2	Homo sapiens (Human)	225
O75940	O75940	reviewed	SPF30_HUMAN	Survival of motor neuron-related-splicing factor 30 (30 kDa splicing factor SMNrp) (SMN-related protein) (Survival motor neuron domain-containing protein 1)	SMNDC1 SMNR SPF30	Homo sapiens (Human)	238
P49458	P49458	reviewed	SRP09_HUMAN	Signal recognition particle 9 kDa protein (SRP9)	SRP9	Homo sapiens (Human)	86
Q9UI30	Q9UI30	reviewed	TR112_HUMAN	Multifunctional methyltransferase subunit TRM112-like protein (tRNA methyltransferase 112 homolog)	TRMT112 AD-001 HSPC152 HSPC170	Homo sapiens (Human)	125
Q9UPN9	Q9UPN9	reviewed	TRI33_HUMAN	E3 ubiquitin-protein ligase TRIM33 (EC 2.3.2.27) (Ectodermin homolog) (RET-fused gene 7 protein) (Protein Rfg7) (RING-type E3 ubiquitin transferase TRIM33) (Transcription intermediary factor 1-gamma) (TIF1-gamma) (Tripartite motif-containing protein 33)	TRIM33 KIAA1113 RFG7 TIF1G	Homo sapiens (Human)	1127
O00567	O00567	reviewed	NOP56_HUMAN	Nucleolar protein 56 (Nucleolar protein 5A)	NOP56 NOL5A	Homo sapiens (Human)	594
O14737	O14737	reviewed	PDCD5_HUMAN	Programmed cell death protein 5 (TF-1 cell apoptosis-related protein 19) (Protein TFAR19)	PDCD5 TFAR19	Homo sapiens (Human)	125
O15355	O15355	reviewed	PPM1G_HUMAN	Protein phosphatase 1G (EC 3.1.3.16) (Protein phosphatase 1C) (Protein phosphatase 2C isoform gamma) (PP2C-gamma) (Protein phosphatase magnesium-dependent 1 gamma)	PPM1G PPM1C	Homo sapiens (Human)	546
O75347	O75347	reviewed	TBCA_HUMAN	Tubulin-specific chaperone A (TCP1-chaperonin cofactor A) (Tubulin-folding cofactor A) (CFA)	TBCA	Homo sapiens (Human)	108
O95373	O95373	reviewed	IPO7_HUMAN	Importin-7 (Imp7) (Ran-binding protein 7) (RanBP7)	IPO7 RANBP7	Homo sapiens (Human)	1038
O95926	O95926	reviewed	SYF2_HUMAN	Pre-mRNA-splicing factor SYF2 (CCNDBP1-interactor) (p29)	SYF2 CBPIN GCIPIP	Homo sapiens (Human)	243
P14174	P14174	reviewed	MIF_HUMAN	Macrophage migration inhibitory factor (MIF) (EC 5.3.2.1) (Glycosylation-inhibiting factor) (GIF) (L-dopachrome isomerase) (L-dopachrome tautomerase) (EC 5.3.3.12) (Phenylpyruvate tautomerase)	MIF GLIF MMIF	Homo sapiens (Human)	115
P16152	P16152	reviewed	CBR1_HUMAN	Carbonyl reductase [NADPH] 1 (EC 1.1.1.184) (15-hydroxyprostaglandin dehydrogenase [NADP(+)]) (EC 1.1.1.196, EC 1.1.1.197) (20-beta-hydroxysteroid dehydrogenase) (Alcohol dehydrogenase [NAD(P)+] CBR1) (EC 1.1.1.71) (NADPH-dependent carbonyl reductase 1) (Prostaglandin 9-ketoreductase) (PG-9-KR) (Prostaglandin-E(2) 9-reductase) (EC 1.1.1.189) (Short chain dehydrogenase/reductase family 21C member 1)	CBR1 CBR CRN SDR21C1	Homo sapiens (Human)	277
P35249	P35249	reviewed	RFC4_HUMAN	Replication factor C subunit 4 (Activator 1 37 kDa subunit) (A1 37 kDa subunit) (Activator 1 subunit 4) (Replication factor C 37 kDa subunit) (RF-C 37 kDa subunit) (RFC37)	RFC4	Homo sapiens (Human)	363
P40937	P40937	reviewed	RFC5_HUMAN	Replication factor C subunit 5 (Activator 1 36 kDa subunit) (A1 36 kDa subunit) (Activator 1 subunit 5) (Replication factor C 36 kDa subunit) (RF-C 36 kDa subunit) (RFC36)	RFC5	Homo sapiens (Human)	340
P57743	P57743	reviewed	LSM3_YEAST	U6 snRNA-associated Sm-like protein LSm3 (SmX4 protein)	LSM3 SMX4 USS2 YLR438C-A	Saccharomyces cerevisiae (strain ATCC 204508 / S288c) (Baker's yeast)	89
P62312	P62312	reviewed	LSM6_HUMAN	U6 snRNA-associated Sm-like protein LSm6	LSM6	Homo sapiens (Human)	80
Q02880	Q02880	reviewed	TOP2B_HUMAN	DNA topoisomerase 2-beta (EC 5.6.2.2) (DNA topoisomerase II, beta isozyme)	TOP2B	Homo sapiens (Human)	1626
Q13315	Q13315	reviewed	ATM_HUMAN	Serine-protein kinase ATM (EC 2.7.11.1) (Ataxia telangiectasia mutated) (A-T mutated)	ATM	Homo sapiens (Human)	3056
Q13356	Q13356	reviewed	PPIL2_HUMAN	RING-type E3 ubiquitin-protein ligase PPIL2 (EC 2.3.2.27) (CYC4) (Cyclophilin-60) (Cyclophilin-like protein Cyp-60) (Cyp60) (hCyP-60) (Probable inactive peptidyl-prolyl cis-trans isomerase-like 2) (PPIase) (Rotamase PPIL2)	PPIL2	Homo sapiens (Human)	520
Q14978	Q14978	reviewed	NOLC1_HUMAN	Nucleolar and coiled-body phosphoprotein 1 (140 kDa nucleolar phosphoprotein) (Nopp140) (Hepatitis C virus NS5A-transactivated protein 13) (HCV NS5A-transactivated protein 13) (Nucleolar 130 kDa protein) (Nucleolar phosphoprotein p130)	NOLC1 KIAA0035 NS5ATP13	Homo sapiens (Human)	699
Q15427	Q15427	reviewed	SF3B4_HUMAN	Splicing factor 3B subunit 4 (Pre-mRNA-splicing factor SF3b 49 kDa subunit) (Spliceosome-associated protein 49) (SAP 49)	SF3B4 SAP49	Homo sapiens (Human)	424
Q7RTV0	Q7RTV0	reviewed	PHF5A_HUMAN	PHD finger-like domain-containing protein 5A (PHD finger-like domain protein 5A) (Splicing factor 3B-associated 14 kDa protein) (SF3b14b)	PHF5A	Homo sapiens (Human)	110
Q8WUA2	Q8WUA2	reviewed	PPIL4_HUMAN	Peptidyl-prolyl cis-trans isomerase-like 4 (PPIase) (EC 5.2.1.8) (Cyclophilin-like protein PPIL4) (Rotamase PPIL4)	PPIL4	Homo sapiens (Human)	492
Q92733	Q92733	reviewed	PRCC_HUMAN	Proline-rich protein PRCC (Papillary renal cell carcinoma translocation-associated gene protein)	PRCC TPRC	Homo sapiens (Human)	491
Q96BP3	Q96BP3	reviewed	PPWD1_HUMAN	Peptidylprolyl isomerase domain and WD repeat-containing protein 1 (EC 5.2.1.8) (Spliceosome-associated cyclophilin)	PPWD1 KIAA0073	Homo sapiens (Human)	646
Q96GM8	Q96GM8	reviewed	TOE1_HUMAN	Target of EGR1 protein 1	TOE1	Homo sapiens (Human)	510
Q96NC0	Q96NC0	reviewed	ZMAT2_HUMAN	Zinc finger matrin-type protein 2	ZMAT2	Homo sapiens (Human)	199
Q96PZ0	Q96PZ0	reviewed	PUS7_HUMAN	Pseudouridylate synthase 7 homolog (EC 5.4.99.-)	PUS7 KIAA1897	Homo sapiens (Human)	661
Q96RS0	Q96RS0	reviewed	TGS1_HUMAN	Trimethylguanosine synthase (EC 2.1.1.-) (CLL-associated antigen KW-2) (Cap-specific guanine-N2 methyltransferase) (Hepatocellular carcinoma-associated antigen 137) (Nuclear receptor coactivator 6-interacting protein) (PRIP-interacting protein with methyltransferase motif) (PIMT) (PIPMT)	TGS1 HCA137 NCOA6IP PIMT	Homo sapiens (Human)	853
Q9BTE3	Q9BTE3	reviewed	MCMBP_HUMAN	Mini-chromosome maintenance complex-binding protein (MCM-BP) (MCM-binding protein)	MCMBP C10orf119	Homo sapiens (Human)	642
Q9BWJ5	Q9BWJ5	reviewed	SF3B5_HUMAN	Splicing factor 3B subunit 5 (SF3b5) (Pre-mRNA-splicing factor SF3b 10 kDa subunit)	SF3B5 SF3B10	Homo sapiens (Human)	86
Q9HCG8	Q9HCG8	reviewed	CWC22_HUMAN	Pre-mRNA-splicing factor CWC22 homolog (Nucampholin homolog) (fSAPb)	CWC22 KIAA1604 NCM	Homo sapiens (Human)	908
Q9NPE3	Q9NPE3	reviewed	NOP10_HUMAN	H/ACA ribonucleoprotein complex subunit 3 (Nucleolar protein 10) (Nucleolar protein family A member 3) (snoRNP protein NOP10)	NOP10 NOLA3	Homo sapiens (Human)	64
Q9NTJ3	Q9NTJ3	reviewed	SMC4_HUMAN	Structural maintenance of chromosomes protein 4 (SMC protein 4) (SMC-4) (Chromosome-associated polypeptide C) (hCAP-C) (XCAP-C homolog)	SMC4 CAPC SMC4L1	Homo sapiens (Human)	1288
Q9UKK9	Q9UKK9	reviewed	NUDT5_HUMAN	ADP-sugar pyrophosphatase (EC 3.6.1.13) (8-oxo-dGDP phosphatase) (EC 3.6.1.58) (Nuclear ATP-synthesis protein NUDIX5) (EC 2.7.7.96) (Nucleoside diphosphate-linked moiety X motif 5) (Nudix motif 5) (hNUDT5) (YSA1H)	NUDT5 NUDIX5 HSPC115	Homo sapiens (Human)	219
Q9ULR0	Q9ULR0	reviewed	ISY1_HUMAN	Pre-mRNA-splicing factor ISY1 homolog	ISY1 KIAA1160	Homo sapiens (Human)	285
Q9UNP9	Q9UNP9	reviewed	PPIE_HUMAN	Peptidyl-prolyl cis-trans isomerase E (PPIase E) (EC 5.2.1.8) (Cyclophilin E) (Cyclophilin-33) (Rotamase E)	PPIE CYP33	Homo sapiens (Human)	301
P40070	P40070	reviewed	LSM4_YEAST	U6 snRNA-associated Sm-like protein LSm4 (Like-SM protein 4)	LSM4 SDB23 USS1 YER112W	Saccharomyces cerevisiae (strain ATCC 204508 / S288c) (Baker's yeast)	187
Q99NB9	Q99NB9	reviewed	SF3B1_MOUSE	Splicing factor 3B subunit 1 (Pre-mRNA-splicing factor SF3b 155 kDa subunit) (SF3b155) (Spliceosome-associated protein 155) (SAP 155)	Sf3b1 Sap155	Mus musculus (Mouse)	1304
O00566	O00566	reviewed	MPP10_HUMAN	U3 small nucleolar ribonucleoprotein protein MPP10 (M phase phosphoprotein 10)	MPHOSPH10 MPP10	Homo sapiens (Human)	681
O43818	O43818	reviewed	U3IP2_HUMAN	U3 small nucleolar RNA-interacting protein 2 (RRP9 homolog) (U3 small nucleolar ribonucleoprotein-associated 55 kDa protein) (U3 snoRNP-associated 55 kDa protein) (U3-55K)	RRP9 RNU3IP2 U355K	Homo sapiens (Human)	475
Q8R1B4	Q8R1B4	reviewed	EIF3C_MOUSE	Eukaryotic translation initiation factor 3 subunit C (eIF3c) (Eukaryotic translation initiation factor 3 subunit 8) (eIF3 p110)	Eif3c Eif3s8	Mus musculus (Mouse)	911
P15646	P15646	reviewed	FBRL_YEAST	rRNA 2'-O-methyltransferase fibrillarin (EC 2.1.1.-) (Histone-glutamine methyltransferase) (U3 small nucleolar RNA-associated protein NOP1) (Nucleolar protein 1) (U3 snoRNA-associated protein NOP1)	NOP1 LOT3 YDL014W D2870	Saccharomyces cerevisiae (strain ATCC 204508 / S288c) (Baker's yeast)	327
P33750	P33750	reviewed	DCA13_YEAST	Protein SOF1 (U3 small nucleolar RNA-associated protein SOF1) (U3 snoRNA-associated protein SOF1)	SOF1 YLL011W L1339	Saccharomyces cerevisiae (strain ATCC 204508 / S288c) (Baker's yeast)	489
Q04217	Q04217	reviewed	DHR1_YEAST	Probable ATP-dependent RNA helicase DHR1 (EC 3.6.4.13) (DEAH box RNA helicase DHR1) (Extracellular mutant protein 16)	ECM16 DHR1 YMR128W YM9553.04	Saccharomyces cerevisiae (strain ATCC 204508 / S288c) (Baker's yeast)	1267
Q06506	Q06506	reviewed	RRP9_YEAST	Ribosomal RNA-processing protein 9	RRP9 YPR137W	Saccharomyces cerevisiae (strain ATCC 204508 / S288c) (Baker's yeast)	573
B1AHD1	B1AHD1	unreviewed	B1AHD1_HUMAN	Ribonucloprotein	SNU13	Homo sapiens (Human)	132
P20053	P20053	reviewed	PRP4_YEAST	U4/U6 small nuclear ribonucleoprotein PRP4 (Pre-mRNA-processing protein 4)	PRP4 RNA4 YPR178W P9705.6	Saccharomyces cerevisiae (strain ATCC 204508 / S288c) (Baker's yeast)	465
Q03338	Q03338	reviewed	PRP3_YEAST	U4/U6 small nuclear ribonucleoprotein PRP3 (Pre-mRNA-splicing factor 3)	PRP3 RNA3 YDR473C D8035.16	Saccharomyces cerevisiae (strain ATCC 204508 / S288c) (Baker's yeast)	469
Q6P2Q9	Q6P2Q9	reviewed	PRP8_HUMAN	Pre-mRNA-processing-splicing factor 8 (220 kDa U5 snRNP-specific protein) (PRP8 homolog) (Splicing factor Prp8) (p220)	PRPF8 PRPC8	Homo sapiens (Human)	2335
P33411	P33411	reviewed	PRP18_YEAST	Pre-mRNA-splicing factor 18	PRP18 YGR006W	Saccharomyces cerevisiae (strain ATCC 204508 / S288c) (Baker's yeast)	251
P36048	P36048	reviewed	SN114_YEAST	Pre-mRNA-splicing factor SNU114 (114 kDa U5 small nuclear ribonucleoprotein component) (Growth inhibitory protein 10)	SNU114 GIN10 YKL173W YKL637	Saccharomyces cerevisiae (strain ATCC 204508 / S288c) (Baker's yeast)	1008
O15116	O15116	reviewed	LSM1_HUMAN	U6 snRNA-associated Sm-like protein LSm1 (Cancer-associated Sm-like) (Small nuclear ribonuclear CaSm)	LSM1 CASM	Homo sapiens (Human)	133
O95777	O95777	reviewed	LSM8_HUMAN	U6 snRNA-associated Sm-like protein LSm8	LSM8	Homo sapiens (Human)	96
P53905	P53905	reviewed	LSM7_YEAST	U6 snRNA-associated Sm-like protein LSm7	LSM7 YNL147W N1202 N1780	Saccharomyces cerevisiae (strain ATCC 204508 / S288c) (Baker's yeast)	115
P38203	P38203	reviewed	LSM2_YEAST	U6 snRNA-associated Sm-like protein LSm2 (Small nuclear ribonucleoprotein D homolog SNP3)	LSM2 SMX5 SNP3 YBL026W YBL0425	Saccharomyces cerevisiae (strain ATCC 204508 / S288c) (Baker's yeast)	95
P40089	P40089	reviewed	LSM5_YEAST	U6 snRNA-associated Sm-like protein LSm5	LSM5 YER146W	Saccharomyces cerevisiae (strain ATCC 204508 / S288c) (Baker's yeast)	93
P49960	P49960	reviewed	PRP24_YEAST	U4/U6 snRNA-associated-splicing factor PRP24 (U4/U6 snRNP protein)	PRP24 YMR268C YM8156.10C	Saccharomyces cerevisiae (strain ATCC 204508 / S288c) (Baker's yeast)	444
P83369	P83369	reviewed	LSM11_HUMAN	U7 snRNA-associated Sm-like protein LSm11	LSM11	Homo sapiens (Human)	360
Q969L4	Q969L4	reviewed	LSM10_HUMAN	U7 snRNA-associated Sm-like protein LSm10	LSM10	Homo sapiens (Human)	123
Q14493	Q14493	reviewed	SLBP_HUMAN	Histone RNA hairpin-binding protein (Histone stem-loop-binding protein)	SLBP HBP	Homo sapiens (Human)	270
Q9NY12	Q9NY12	reviewed	GAR1_HUMAN	H/ACA ribonucleoprotein complex subunit 1 (Nucleolar protein family A member 1) (snoRNP protein GAR1)	GAR1 NOLA1	Homo sapiens (Human)	217
M0R1H0	M0R1H0	unreviewed	M0R1H0_HUMAN	Fibrillarin (rRNA 2'-O-methyltransferase fibrillarin)	FBL	Homo sapiens (Human)	178
Q9ULV3	Q9ULV3	reviewed	CIZ1_HUMAN	Cip1-interacting zinc finger protein (CDKN1A-interacting zinc finger protein 1) (Nuclear protein NP94) (Zinc finger protein 356)	CIZ1 LSFR1 NP94 ZNF356	Homo sapiens (Human)	898
Q501J6	Q501J6	reviewed	DDX17_MOUSE	Probable ATP-dependent RNA helicase DDX17 (EC 3.6.4.13) (DEAD box protein 17)	Ddx17	Mus musculus (Mouse)	650
Q8VDW0	Q8VDW0	reviewed	DX39A_MOUSE	ATP-dependent RNA helicase DDX39A (EC 3.6.4.13) (DEAD box protein 39)	Ddx39a Ddx39	Mus musculus (Mouse)	427
Q9Z1N5	Q9Z1N5	reviewed	DX39B_MOUSE	Spliceosome RNA helicase Ddx39b (EC 3.6.4.13) (56 kDa U2AF65-associated protein) (DEAD box protein UAP56) (HLA-B-associated transcript 1 protein)	Ddx39b Bat1 Bat1a Uap56	Mus musculus (Mouse)	428
Q91VC3	Q91VC3	reviewed	IF4A3_MOUSE	Eukaryotic initiation factor 4A-III (eIF-4A-III) (eIF4A-III) (EC 3.6.4.13) (ATP-dependent RNA helicase DDX48) (ATP-dependent RNA helicase eIF4A-3) (DEAD box protein 48) (Eukaryotic translation initiation factor 4A isoform 3) [Cleaved into: Eukaryotic initiation factor 4A-III, N-terminally processed]	Eif4a3 Ddx48	Mus musculus (Mouse)	411
O88569	O88569	reviewed	ROA2_MOUSE	Heterogeneous nuclear ribonucleoproteins A2/B1 (hnRNP A2/B1)	Hnrnpa2b1 Hnrpa2b1	Mus musculus (Mouse)	353
H7C1J8	H7C1J8	unreviewed	H7C1J8_HUMAN	Heterogeneous nuclear ribonucleoprotein A3	HNRNPA3	Homo sapiens (Human)	115
D6RD18	D6RD18	unreviewed	D6RD18_HUMAN	Heterogeneous nuclear ribonucleoprotein A/B	HNRNPAB	Homo sapiens (Human)	283
H0YA96	H0YA96	unreviewed	H0YA96_HUMAN	Heterogeneous nuclear ribonucleoprotein D	HNRNPD	Homo sapiens (Human)	210
Q6NTA2	Q6NTA2	unreviewed	Q6NTA2_HUMAN	HNRNPL protein	HNRNPL	Homo sapiens (Human)	572
B4DT28	B4DT28	unreviewed	B4DT28_HUMAN	Heterogeneous nuclear ribonucleoprotein R (Heterogeneous nuclear ribonucleoprotein R, isoform CRA_a) (cDNA FLJ54544, highly similar to Heterogeneous nuclear ribonucleoprotein R)	HNRNPR HNRPR hCG_38907	Homo sapiens (Human)	494
Q921F4	Q921F4	reviewed	HNRLL_MOUSE	Heterogeneous nuclear ribonucleoprotein L-like	Hnrnpll Hnrpll	Mus musculus (Mouse)	591
F8WD15	F8WD15	unreviewed	F8WD15_HUMAN	Insulin like growth factor 2 mRNA binding protein 3	IGF2BP3	Homo sapiens (Human)	81
Q60749	Q60749	reviewed	KHDR1_MOUSE	KH domain-containing, RNA-binding, signal transduction-associated protein 1 (GAP-associated tyrosine phosphoprotein p62) (Src-associated in mitosis 68 kDa protein) (Sam68) (p21 Ras GTPase-activating protein-associated p62) (p68)	Khdrbs1	Mus musculus (Mouse)	443
Q3U0V1	Q3U0V1	reviewed	FUBP2_MOUSE	Far upstream element-binding protein 2 (FUSE-binding protein 2) (KH type-splicing regulatory protein) (KSRP)	Khsrp Fubp2	Mus musculus (Mouse)	748
Q587J6	Q587J6	reviewed	LITD1_MOUSE	LINE-1 type transposase domain-containing protein 1 (ES cell-associated protein 11)	L1td1 Ecat11	Mus musculus (Mouse)	782
Q8K3Y3	Q8K3Y3	reviewed	LN28A_MOUSE	Protein lin-28 homolog A (Lin-28A) (Testis-expressed protein 17)	Lin28a Lin28 Tex17	Mus musculus (Mouse)	209
Q7TPV4	Q7TPV4	reviewed	MBB1A_MOUSE	Myb-binding protein 1A (Myb-binding protein of 160 kDa)	Mybbp1a P160	Mus musculus (Mouse)	1344
Q8C854	Q8C854	reviewed	MYEF2_MOUSE	Myelin expression factor 2 (MEF-2) (MyEF-2)	Myef2 Kiaa1341 Mef2	Mus musculus (Mouse)	591
Q86SE9	Q86SE9	reviewed	PCGF5_HUMAN	Polycomb group RING finger protein 5 (RING finger protein 159)	PCGF5 RNF159	Homo sapiens (Human)	256
Q8BG81	Q8BG81	reviewed	PDIP3_MOUSE	Polymerase delta-interacting protein 3 (S6K1 Aly/REF-like target) (SKAR)	Poldip3	Mus musculus (Mouse)	420
Q91Z31	Q91Z31	reviewed	PTBP2_MOUSE	Polypyrimidine tract-binding protein 2 (Brain-enriched polypyrimidine tract-binding protein) (Brain-enriched PTB) (Neural polypyrimidine tract-binding protein) (RRM-type RNA-binding protein brPTB)	Ptbp2 Brptb Nptb	Mus musculus (Mouse)	531
B0QYV1	B0QYV1	unreviewed	B0QYV1_HUMAN	RNA binding protein fox-1 homolog 2	RBFOX2	Homo sapiens (Human)	357
O89086	O89086	reviewed	RBM3_MOUSE	RNA-binding protein 3 (RNA-binding motif protein 3)	Rbm3	Mus musculus (Mouse)	153
Q91VM5	Q91VM5	reviewed	RMXL1_MOUSE	RNA binding motif protein, X-linked-like-1 (Heterogeneous nuclear ribonucleoprotein G-like 1) (RNA binding motif protein, X chromosome retrogene)	Rbmxl1 Rbmxrt	Mus musculus (Mouse)	388
Q5DTM8	Q5DTM8	reviewed	BRE1A_MOUSE	E3 ubiquitin-protein ligase BRE1A (BRE1-A) (EC 2.3.2.27) (RING finger protein 20) (RING-type E3 ubiquitin transferase BRE1A)	Rnf20 Bre1a Kiaa4116	Mus musculus (Mouse)	973
Q05D80	Q05D80	unreviewed	Q05D80_HUMAN	mRNA (guanine-N(7))-methyltransferase (EC 2.1.1.56) (RG7MT1)	RNMT	Homo sapiens (Human)	410
Q8N488	Q8N488	reviewed	RYBP_HUMAN	RING1 and YY1-binding protein (Apoptin-associating protein 1) (APAP-1) (Death effector domain-associated factor) (DED-associated factor) (YY1 and E4TF1-associated factor 1)	RYBP DEDAF YEAF1	Homo sapiens (Human)	228
D3YXK2	D3YXK2	reviewed	SAFB1_MOUSE	Scaffold attachment factor B1 (SAF-B1)	Safb Safb1	Mus musculus (Mouse)	937
Q62504	Q62504	reviewed	MINT_MOUSE	Msx2-interacting protein (SMART/HDAC1-associated repressor protein) (SPEN homolog)	Spen Kiaa0929 Mint Sharp	Mus musculus (Mouse)	3644
Q9R0U0	Q9R0U0	reviewed	SRS10_MOUSE	Serine/arginine-rich splicing factor 10 (FUS-interacting serine-arginine-rich protein 1) (Neural-salient serine/arginine-rich protein) (Neural-specific SR protein) (Splicing factor, arginine/serine-rich 13A) (TLS-associated protein with Ser-Arg repeats) (TASR) (TLS-associated protein with SR repeats) (TLS-associated serine-arginine protein) (TLS-associated SR protein)	Srsf10 Fusip1 Nssr Sfrs13a Srsf13a	Mus musculus (Mouse)	262
O08583	O08583	reviewed	THOC4_MOUSE	THO complex subunit 4 (Tho4) (Ally of AML-1 and LEF-1) (Aly/REF export factor) (REF1-I) (RNA and export factor-binding protein 1) (Transcriptional coactivator Aly/REF)	Alyref Aly Ref1 Refbp1 THOC4	Mus musculus (Mouse)	255
Q8BGE7	Q8BGE7	reviewed	TRIM6_MOUSE	Tripartite motif-containing protein 6 (EC 2.3.2.27) (RING-type E3 ubiquitin transferase TRIM6)	Trim6	Mus musculus (Mouse)	488
Q1PSW8	Q1PSW8	reviewed	LIN41_MOUSE	E3 ubiquitin-protein ligase TRIM71 (EC 2.3.2.27) (Protein lin-41 homolog) (mLin41) (RING-type E3 ubiquitin transferase TRIM71) (Tripartite motif-containing protein 71)	Trim71 Gm1127 Lin41	Mus musculus (Mouse)	855
Q9ER69	Q9ER69	reviewed	FL2D_MOUSE	Pre-mRNA-splicing regulator WTAP (Female-lethal(2)D homolog) (WT1-associated protein) (Wilms tumor 1-associating protein)	Wtap	Mus musculus (Mouse)	396
E9Q5K9	E9Q5K9	reviewed	YTDC1_MOUSE	YTH domain-containing protein 1	Ythdc1 Kiaa1966	Mus musculus (Mouse)	736
Q96KR1	Q96KR1	reviewed	ZFR_HUMAN	Zinc finger RNA-binding protein (hZFR) (M-phase phosphoprotein homolog)	ZFR	Homo sapiens (Human)	1074
Q03518	Q03518	reviewed	TAP1_HUMAN	Antigen peptide transporter 1 (APT1) (EC 7.4.2.14) (ATP-binding cassette sub-family B member 2) (Peptide supply factor 1) (Peptide transporter PSF1) (PSF-1) (Peptide transporter TAP1) (Peptide transporter involved in antigen processing 1) (Really interesting new gene 4 protein) (RING4)	TAP1 ABCB2 PSF1 RING4 Y3	Homo sapiens (Human)	748
Q13070	Q13070	reviewed	GAGE6_HUMAN	G antigen 6 (GAGE-6) (Cancer/testis antigen 4.6) (CT4.6)	GAGE6	Homo sapiens (Human)	117
P20263	P20263	reviewed	PO5F1_MOUSE	POU domain, class 5, transcription factor 1 (NF-A3) (Octamer-binding protein 3) (Oct-3) (Octamer-binding protein 4) (Oct-4) (Octamer-binding transcription factor 3) (OTF-3)	Pou5f1 Oct-3 Oct-4 Otf-3 Otf3	Mus musculus (Mouse)	352
B3FTN5	B3FTN5	unreviewed	B3FTN5_HUMAN	Truncated insulin-like 2 growth factor 2-binding protein 2	IGF2BP2	Homo sapiens (Human)	55
P49918	P49918	reviewed	CDN1C_HUMAN	Cyclin-dependent kinase inhibitor 1C (Cyclin-dependent kinase inhibitor p57) (p57Kip2)	CDKN1C KIP2	Homo sapiens (Human)	316
P16104	P16104	reviewed	H2AX_HUMAN	Histone H2AX (H2a/x) (Histone H2A.X)	H2AX H2AFX	Homo sapiens (Human)	143
P38936	P38936	reviewed	CDN1A_HUMAN	Cyclin-dependent kinase inhibitor 1 (CDK-interacting protein 1) (Melanoma differentiation-associated protein 6) (MDA-6) (p21)	CDKN1A CAP20 CDKN1 CIP1 MDA6 PIC1 SDI1 WAF1	Homo sapiens (Human)	164
P10415	P10415	reviewed	BCL2_HUMAN	Apoptosis regulator Bcl-2	BCL2	Homo sapiens (Human)	239
Q9BXH1	Q9BXH1	reviewed	BBC3_HUMAN	Bcl-2-binding component 3, isoforms 1/2 (JFY-1) (p53 up-regulated modulator of apoptosis)	BBC3 PUMA	Homo sapiens (Human)	193
Q07812	Q07812	reviewed	BAX_HUMAN	Apoptosis regulator BAX (Bcl-2-like protein 4) (Bcl2-L-4)	BAX BCL2L4	Homo sapiens (Human)	192
D3YPQ1	D3YPQ1	unreviewed	D3YPQ1_HUMAN	Androgen receptor (Dihydrotestosterone receptor) (Nuclear receptor subfamily 3 group C member 4)	AR	Homo sapiens (Human)	920
Q9HC16	Q9HC16	reviewed	ABC3G_HUMAN	DNA dC->dU-editing enzyme APOBEC-3G (EC 3.5.4.38) (APOBEC-related cytidine deaminase) (APOBEC-related protein) (ARCD) (APOBEC-related protein 9) (ARP-9) (CEM-15) (CEM15) (Deoxycytidine deaminase) (A3G)	APOBEC3G MDS019	Homo sapiens (Human)	384
P42224	P42224	reviewed	STAT1_HUMAN	Signal transducer and activator of transcription 1-alpha/beta (Transcription factor ISGF-3 components p91/p84)	STAT1	Homo sapiens (Human)	750
P32899	P32899	reviewed	IMP3_YEAST	U3 small nucleolar ribonucleoprotein protein IMP3 (U3 snoRNP protein IMP3) (Interacting with MPP10 protein 3)	IMP3 YHR148W	Saccharomyces cerevisiae (strain ATCC 204508 / S288c) (Baker's yeast)	183
E9PR99	E9PR99	unreviewed	E9PR99_HUMAN	Inner mitochondrial membrane peptidase subunit 1	IMMP1L	Homo sapiens (Human)	94
